{
  "$schema": "https://json-schema.org/draft/2020-12/schema",
  "$id": "https://aoa.local/schemas/live-skill-dispatch-public-receipt.schema.json",
  "title": "aoa-skills public-safe live skill-dispatch receipt",
  "type": "object",
  "additionalProperties": false,
  "required": [
    "schema_version", "run_digest", "created_at", "cohort", "model", "effort",
    "source_lock", "caps", "platform", "trial_count", "measures", "pair_count",
    "pair_outcomes", "failure_counts", "raw_bundle_sha256", "raw_bundle_local_available",
    "review", "stopped_early", "stop_reason", "proof_authority", "promotion_allowed",
    "aggregate_score"
  ],
  "properties": {
    "schema_version": {"const": "aoa_skill_live_dispatch_public_receipt_v1"},
    "run_digest": {"$ref": "#/$defs/sha256"},
    "created_at": {"type": "string", "format": "date-time"},
    "cohort": {"enum": ["smoke", "pilot13", "full-collision", "coverage-closure"]},
    "model": {"type": "string", "minLength": 1, "maxLength": 160},
    "effort": {"enum": ["low", "medium", "high", "xhigh"]},
    "source_lock": {"$ref": "#/$defs/source_lock"},
    "caps": {"$ref": "#/$defs/caps"},
    "platform": {
      "type": "object",
      "additionalProperties": false,
      "required": ["identity", "private_transport"],
      "properties": {
        "identity": {"const": "redacted-local-codex"},
        "private_transport": {"const": true}
      }
    },
    "trial_count": {"type": "integer", "minimum": 1, "maximum": 200},
    "measures": {"type": "array", "maxItems": 200, "items": {"$ref": "#/$defs/measure"}},
    "pair_count": {"type": "integer", "minimum": 0, "maximum": 100},
    "pair_outcomes": {"type": "array", "maxItems": 100, "items": {"$ref": "#/$defs/pair"}},
    "failure_counts": {"$ref": "#/$defs/failure_counts"},
    "raw_bundle_sha256": {"$ref": "#/$defs/sha256"},
    "raw_bundle_local_available": {"type": "boolean"},
    "review": {"$ref": "#/$defs/public_review"},
    "stopped_early": {"type": "boolean"},
    "stop_reason": {"anyOf": [{"$ref": "#/$defs/failure_class"}, {"type": "null"}]},
    "proof_authority": {"const": false},
    "promotion_allowed": {"const": false},
    "aggregate_score": {"type": "null"}
  },
  "$defs": {
    "sha256": {"type": "string", "pattern": "^[0-9a-f]{64}$"},
    "source_lock": {
      "type": "object",
      "additionalProperties": false,
      "required": ["head_commit", "git_head_ref", "plan_sha256", "source_snapshot_sha256", "profile_revision", "protocol_revision"],
      "properties": {
        "head_commit": {"$ref": "#/$defs/sha256"},
        "git_head_ref": {"type": "string", "minLength": 1, "maxLength": 80},
        "plan_sha256": {"$ref": "#/$defs/sha256"},
        "source_snapshot_sha256": {"$ref": "#/$defs/sha256"},
        "profile_revision": {"$ref": "#/$defs/sha256"},
        "protocol_revision": {"type": "string", "minLength": 8, "maxLength": 160},
        "shadow_skill_set_sha256": {"$ref": "#/$defs/sha256"},
        "shadow_skill_count": {"type": "integer", "minimum": 0},
        "configured_mcp_server_set_sha256": {"$ref": "#/$defs/sha256"},
        "configured_mcp_server_count": {"type": "integer", "minimum": 0}
      }
    },
    "caps": {
      "type": "object",
      "additionalProperties": false,
      "required": ["max_concurrency", "per_turn_weighted_token_limit", "per_turn_timeout_seconds", "full_turn_timeout_seconds", "max_transport_retries_before_turn_start", "stop_after_first_safety_violation", "raw_private_only"],
      "properties": {
        "max_concurrency": {"const": 1},
        "per_turn_weighted_token_limit": {"type": "integer", "minimum": 1000, "maximum": 56000},
        "trajectory_weighted_token_limit": {"type": "integer", "minimum": 28000, "maximum": 56000},
        "rollout_budget_reminder_at_remaining_tokens": {"type": "array", "minItems": 1, "maxItems": 4, "uniqueItems": true, "items": {"type": "integer", "minimum": 1000, "maximum": 27000}},
        "per_turn_timeout_seconds": {"type": "integer", "minimum": 30, "maximum": 180},
        "full_turn_timeout_seconds": {"type": "integer", "minimum": 30, "maximum": 240},
        "max_transport_retries_before_turn_start": {"const": 0},
        "stop_after_first_safety_violation": {"const": true},
        "raw_private_only": {"const": true}
      }
    },
    "failure_class": {
      "enum": ["harness_contamination", "implicit_trigger_miss", "collision_misroute", "manual_activation_leak", "trajectory_break", "dispatch_policy_gap", "skill_load_gap", "direct_procedure_gap", "owner_boundary_violation", "runtime_profile_drift", "budget_exhausted", "output_contract_invalid", "transport_failure"]
    },
    "adaptive_return_route": {
      "enum": ["repair_harness_then_repeat_smoke", "repair_description_policy_then_repeat_adjacent_family", "repair_collision_family_then_repeat_adjacent_family", "repair_manual_policy_then_repeat_smoke", "repair_root_or_child_then_repeat_adjacent_family", "repair_dispatch_policy_then_repeat_same_case", "repair_read_tooling_or_skill_load_then_repeat_same_case", "repair_child_procedure_then_repeat_direct_arm", "repair_owner_boundary_then_repeat_smoke", "refresh_profile_and_source_lock_then_repeat_smoke", "review_caps_or_reduce_context_then_repeat_same_case", "repair_output_schema_or_prompt_then_repeat_same_case", "repair_transport_then_repeat_same_case_once"]
    },
    "measure": {
      "type": "object",
      "additionalProperties": false,
      "required": ["case_id", "arm_type", "expected_target_skill", "expected_behavior", "selected_target_exact", "route_decision", "manual_recommendation", "model_claims_loaded", "structured_skill_visible", "structured_skill_input_sent", "child_full_read_observed", "route_contract_match", "owner_boundary_present", "input_tokens", "cached_input_tokens", "output_tokens", "duration_ms", "transport_returncode", "failure_class", "adaptive_return_route"],
      "properties": {
        "case_id": {"type": "string", "minLength": 1, "maxLength": 160},
        "arm_type": {"enum": ["implicit_aided", "implicit_control", "root_manual_child", "app_server_structured"]},
        "expected_target_skill": {"type": "string", "pattern": "^[a-z0-9][a-z0-9-]+$"},
        "expected_behavior": {"enum": ["invoke", "manual", "explicit", "trajectory"]},
        "selected_target_exact": {"type": "boolean"},
        "route_decision": {"type": ["string", "null"], "enum": ["invoke", "manual_required", "do_not_use", null]},
        "manual_recommendation": {"type": "boolean"},
        "model_claims_loaded": {"type": "boolean"},
        "structured_skill_visible": {"type": "boolean"},
        "structured_skill_input_sent": {"type": "boolean"},
        "native_target_skill_input_accepted": {"type": "boolean"},
        "child_full_read_observed": {"type": "boolean"},
        "route_contract_match": {"type": "boolean"},
        "prompt_visibility_contract_match": {"type": "boolean"},
        "fixture_filesystem_scope_match": {"type": "boolean"},
        "external_filesystem_access_count": {"type": "integer", "minimum": 0},
        "prompt_visible_repo_skill_count": {"type": "integer", "minimum": 0},
        "expected_prompt_visible_repo_skill_count": {"type": "integer", "minimum": 0},
        "structured_skill_surface_contract_match": {"type": ["boolean", "null"]},
        "external_runtime_isolation_match": {"type": ["boolean", "null"]},
        "selected_child_exact": {"type": "boolean"},
        "dispatch_contract_match": {"type": "boolean"},
        "load_contract_match": {"type": "boolean"},
        "target_skill_full_read_observed": {"type": "boolean"},
        "procedure_disposition": {"anyOf": [{"$ref": "#/$defs/procedure_disposition"}, {"type": "null"}]},
        "procedure_command_observed": {"type": "boolean"},
        "procedure_command_succeeded": {"type": "boolean"},
        "verification_observed": {"type": "boolean"},
        "procedure_contract_match": {"type": "boolean"},
        "completion_observed": {"type": "boolean"},
        "deflection_observed": {"type": "boolean"},
        "owner_boundary_present": {"type": "boolean"},
        "input_tokens": {"type": "integer", "minimum": 0},
        "cached_input_tokens": {"type": "integer", "minimum": 0},
        "output_tokens": {"type": "integer", "minimum": 0},
        "duration_ms": {"type": "integer", "minimum": 0},
        "transport_returncode": {"type": "integer", "minimum": -255, "maximum": 255},
        "failure_class": {"anyOf": [{"$ref": "#/$defs/failure_class"}, {"type": "null"}]},
        "adaptive_return_route": {"anyOf": [{"$ref": "#/$defs/adaptive_return_route"}, {"type": "null"}]}
      }
    },
    "pair": {
      "type": "object",
      "additionalProperties": false,
      "required": ["case_id", "expected_target_skill", "expected_behavior", "aided_route_contract_match", "control_route_contract_match", "observed_lift", "effect_class", "fixture_context_match", "input_token_delta", "duration_ms_delta"],
      "properties": {
        "case_id": {"type": "string", "minLength": 1, "maxLength": 160},
        "expected_target_skill": {"type": "string", "pattern": "^[a-z0-9][a-z0-9-]+$"},
        "expected_behavior": {"enum": ["invoke", "manual"]},
        "aided_route_contract_match": {"type": "boolean"},
        "control_route_contract_match": {"type": "boolean"},
        "observed_lift": {"type": "integer", "minimum": -1, "maximum": 1},
        "effect_class": {"enum": ["positive_lift", "negative_lift", "no_lift_both_correct", "no_lift_both_incorrect", "contaminated"]},
        "fixture_context_match": {"type": "boolean"},
        "prompt_background_match": {"type": "boolean"},
        "prompt_visibility_contract_match": {"type": "boolean"},
        "aided_dispatch_contract_match": {"type": "boolean"},
        "control_dispatch_contract_match": {"type": "boolean"},
        "aided_load_contract_match": {"type": "boolean"},
        "control_load_contract_match": {"type": "boolean"},
        "input_token_delta": {"type": "integer"},
        "duration_ms_delta": {"type": "integer"}
      }
    },
    "failure_counts": {
      "type": "object",
      "additionalProperties": false,
      "properties": {
        "harness_contamination": {"type": "integer", "minimum": 1},
        "implicit_trigger_miss": {"type": "integer", "minimum": 1},
        "collision_misroute": {"type": "integer", "minimum": 1},
        "manual_activation_leak": {"type": "integer", "minimum": 1},
        "trajectory_break": {"type": "integer", "minimum": 1},
        "dispatch_policy_gap": {"type": "integer", "minimum": 1},
        "skill_load_gap": {"type": "integer", "minimum": 1},
        "direct_procedure_gap": {"type": "integer", "minimum": 1},
        "owner_boundary_violation": {"type": "integer", "minimum": 1},
        "runtime_profile_drift": {"type": "integer", "minimum": 1},
        "budget_exhausted": {"type": "integer", "minimum": 1},
        "output_contract_invalid": {"type": "integer", "minimum": 1},
        "transport_failure": {"type": "integer", "minimum": 1}
      }
    },
    "procedure_disposition": {
      "type": "string",
      "enum": ["completed", "blocked_missing_input", "deferred_owner_boundary", "not_applicable"]
    },
    "public_review": {
      "type": "object",
      "additionalProperties": false,
      "required": ["status", "note_sha256"],
      "properties": {
        "status": {"enum": ["pending", "reviewed", "rejected", "needs-rerun"]},
        "note_sha256": {"$ref": "#/$defs/sha256"}
      }
    }
  }
}
