{
  "schema_version": "aoa_skill_live_dispatch_public_receipt_v1",
  "run_digest": "c0d863838122a6b65b92cbf6324d57cdd2af8e3be1cb8b507aec9a96de1a2bc8",
  "created_at": "2026-07-11T22:18:01Z",
  "cohort": "smoke",
  "model": "gpt-5.6-sol",
  "effort": "medium",
  "source_lock": {
    "head_commit": "feb404628f0f29160e5a6a2e23d1407a2fe1eb0d406d206a8f71074b93010172",
    "git_head_ref": "64020ea8ddcafbe4568e0ebbeff4f38694df2501",
    "plan_sha256": "c6c3799c526440c8a759b4114e25be380db346197d55ecc90207cf40e21a51b8",
    "source_snapshot_sha256": "4c6ca4e2cbd4db810949ac0aaa4980ff4601e3e2d1e6610c3d5e2af17bae435e",
    "profile_revision": "cf01327152e819c6bb810645dd203d8f90224574b568e623ec5dc6328045b9df",
    "protocol_revision": "codex-cli-0.144.1-app-server-skill-input-v3",
    "shadow_skill_set_sha256": "a2c4df93b9cd38f8b4c3df4e276d936eff7622d80699d583ed623ec961fab2fe",
    "shadow_skill_count": 37,
    "configured_mcp_server_set_sha256": "92fd3f08afa7555e348af72471af48fcbbd0806031c7eda8966008dceafd0454",
    "configured_mcp_server_count": 11
  },
  "caps": {
    "max_concurrency": 1,
    "per_turn_weighted_token_limit": 48000,
    "trajectory_weighted_token_limit": 48000,
    "rollout_budget_reminder_at_remaining_tokens": [
      4000
    ],
    "per_turn_timeout_seconds": 180,
    "full_turn_timeout_seconds": 240,
    "max_transport_retries_before_turn_start": 0,
    "stop_after_first_safety_violation": true,
    "raw_private_only": true
  },
  "platform": {
    "identity": "redacted-local-codex",
    "private_transport": true
  },
  "trial_count": 3,
  "measures": [
    {
      "case_id": "collision-42",
      "arm_type": "implicit_aided",
      "expected_target_skill": "aoa-eval",
      "expected_behavior": "invoke",
      "selected_target_exact": true,
      "selected_child_exact": false,
      "route_decision": "invoke",
      "manual_recommendation": false,
      "model_claims_loaded": false,
      "structured_skill_visible": false,
      "structured_skill_input_sent": false,
      "native_target_skill_input_accepted": false,
      "child_full_read_observed": false,
      "target_skill_full_read_observed": true,
      "prompt_visibility_contract_match": true,
      "prompt_visible_repo_skill_count": 12,
      "expected_prompt_visible_repo_skill_count": 12,
      "structured_skill_surface_contract_match": null,
      "external_runtime_isolation_match": null,
      "dispatch_contract_match": true,
      "load_contract_match": false,
      "procedure_disposition": "blocked_missing_input",
      "procedure_command_observed": true,
      "procedure_command_succeeded": true,
      "verification_observed": true,
      "procedure_contract_match": false,
      "completion_observed": false,
      "deflection_observed": true,
      "route_contract_match": false,
      "owner_boundary_present": true,
      "input_tokens": 41801,
      "cached_input_tokens": 25088,
      "output_tokens": 1693,
      "duration_ms": 40196,
      "transport_returncode": 0,
      "failure_class": "skill_load_gap",
      "adaptive_return_route": "repair_read_tooling_or_skill_load_then_repeat_same_case"
    },
    {
      "case_id": "collision-42",
      "arm_type": "implicit_control",
      "expected_target_skill": "aoa-eval",
      "expected_behavior": "invoke",
      "selected_target_exact": false,
      "selected_child_exact": false,
      "route_decision": "invoke",
      "manual_recommendation": false,
      "model_claims_loaded": true,
      "structured_skill_visible": false,
      "structured_skill_input_sent": false,
      "native_target_skill_input_accepted": false,
      "child_full_read_observed": false,
      "target_skill_full_read_observed": false,
      "prompt_visibility_contract_match": true,
      "prompt_visible_repo_skill_count": 0,
      "expected_prompt_visible_repo_skill_count": 0,
      "structured_skill_surface_contract_match": null,
      "external_runtime_isolation_match": null,
      "dispatch_contract_match": false,
      "load_contract_match": false,
      "procedure_disposition": "blocked_missing_input",
      "procedure_command_observed": true,
      "procedure_command_succeeded": true,
      "verification_observed": true,
      "procedure_contract_match": false,
      "completion_observed": false,
      "deflection_observed": true,
      "route_contract_match": false,
      "owner_boundary_present": true,
      "input_tokens": 70326,
      "cached_input_tokens": 45312,
      "output_tokens": 1792,
      "duration_ms": 38728,
      "transport_returncode": 0,
      "failure_class": null,
      "adaptive_return_route": null
    },
    {
      "case_id": "collision-45",
      "arm_type": "root_manual_child",
      "expected_target_skill": "aoa-eval",
      "expected_behavior": "trajectory",
      "selected_target_exact": true,
      "selected_child_exact": true,
      "route_decision": "invoke",
      "manual_recommendation": false,
      "model_claims_loaded": false,
      "structured_skill_visible": false,
      "structured_skill_input_sent": false,
      "native_target_skill_input_accepted": true,
      "child_full_read_observed": false,
      "target_skill_full_read_observed": false,
      "prompt_visibility_contract_match": true,
      "prompt_visible_repo_skill_count": 12,
      "expected_prompt_visible_repo_skill_count": 12,
      "structured_skill_surface_contract_match": null,
      "external_runtime_isolation_match": null,
      "dispatch_contract_match": true,
      "load_contract_match": false,
      "procedure_disposition": "completed",
      "procedure_command_observed": true,
      "procedure_command_succeeded": true,
      "verification_observed": true,
      "procedure_contract_match": true,
      "completion_observed": true,
      "deflection_observed": false,
      "route_contract_match": false,
      "owner_boundary_present": true,
      "input_tokens": 30291,
      "cached_input_tokens": 20992,
      "output_tokens": 1336,
      "duration_ms": 32663,
      "transport_returncode": 0,
      "failure_class": "transport_failure",
      "adaptive_return_route": "repair_transport_then_repeat_same_case_once"
    }
  ],
  "pair_count": 1,
  "pair_outcomes": [
    {
      "case_id": "collision-42",
      "expected_target_skill": "aoa-eval",
      "expected_behavior": "invoke",
      "aided_route_contract_match": false,
      "control_route_contract_match": false,
      "observed_lift": 0,
      "effect_class": "no_lift_both_incorrect",
      "fixture_context_match": true,
      "prompt_background_match": true,
      "prompt_visibility_contract_match": true,
      "aided_dispatch_contract_match": true,
      "control_dispatch_contract_match": false,
      "aided_load_contract_match": false,
      "control_load_contract_match": false,
      "input_token_delta": -28525,
      "duration_ms_delta": 1468
    }
  ],
  "failure_counts": {
    "skill_load_gap": 1,
    "transport_failure": 1
  },
  "raw_bundle_sha256": "339cbe91c6b494cf851127338bdc6744b27dd5c9449a5d1f134c17a5db89b8a8",
  "raw_bundle_local_available": true,
  "review": {
    "status": "needs-rerun",
    "note_sha256": "8fda4d89939229fa74df3079f73e24031bbacdaa2a971478eead7d76e300f3b8"
  },
  "stopped_early": true,
  "stop_reason": "transport_failure",
  "proof_authority": false,
  "promotion_allowed": false,
  "aggregate_score": null
}
