{
  "schema_version": "aoa_skill_live_dispatch_public_receipt_v1",
  "run_digest": "92256f29f567b3363d13fd623109afc4f877e341136ee60e53730bfaa9107710",
  "created_at": "2026-07-11T23:35:08Z",
  "cohort": "smoke",
  "model": "gpt-5.6-sol",
  "effort": "medium",
  "source_lock": {
    "head_commit": "c143481ae96fc052683954c1830dda6e978227f1e96dfcf5c17a492e277b5929",
    "git_head_ref": "b61f82ad97a06198cbf374e1a0505a6cfe313a92",
    "plan_sha256": "f66ca3d84f2b85740fd98bcc0313bcfb636f73b4cf3659bd18adae83aefc02cf",
    "source_snapshot_sha256": "868bb623e266f585ef4bbe6cd892d8452119530bd446f32dfb0b5e29caaab535",
    "profile_revision": "cf01327152e819c6bb810645dd203d8f90224574b568e623ec5dc6328045b9df",
    "protocol_revision": "codex-cli-0.144.1-live-dispatch-evidence-v5",
    "shadow_skill_set_sha256": "a2c4df93b9cd38f8b4c3df4e276d936eff7622d80699d583ed623ec961fab2fe",
    "shadow_skill_count": 37,
    "configured_mcp_server_set_sha256": "92fd3f08afa7555e348af72471af48fcbbd0806031c7eda8966008dceafd0454",
    "configured_mcp_server_count": 11
  },
  "caps": {
    "max_concurrency": 1,
    "per_turn_weighted_token_limit": 48000,
    "trajectory_weighted_token_limit": 48000,
    "rollout_budget_reminder_at_remaining_tokens": [
      4000
    ],
    "per_turn_timeout_seconds": 180,
    "full_turn_timeout_seconds": 240,
    "max_transport_retries_before_turn_start": 0,
    "stop_after_first_safety_violation": true,
    "raw_private_only": true
  },
  "platform": {
    "identity": "redacted-local-codex",
    "private_transport": true
  },
  "trial_count": 4,
  "measures": [
    {
      "case_id": "collision-42",
      "arm_type": "implicit_aided",
      "expected_target_skill": "aoa-eval",
      "expected_behavior": "invoke",
      "selected_target_exact": true,
      "selected_child_exact": false,
      "route_decision": "invoke",
      "manual_recommendation": false,
      "model_claims_loaded": true,
      "structured_skill_visible": false,
      "structured_skill_input_sent": false,
      "native_target_skill_input_accepted": false,
      "child_full_read_observed": true,
      "target_skill_full_read_observed": false,
      "prompt_visibility_contract_match": true,
      "fixture_filesystem_scope_match": true,
      "external_filesystem_access_count": 0,
      "prompt_visible_repo_skill_count": 12,
      "expected_prompt_visible_repo_skill_count": 12,
      "structured_skill_surface_contract_match": null,
      "external_runtime_isolation_match": null,
      "dispatch_contract_match": true,
      "load_contract_match": false,
      "procedure_disposition": "completed",
      "procedure_command_observed": true,
      "procedure_command_succeeded": true,
      "verification_observed": true,
      "procedure_contract_match": false,
      "completion_observed": false,
      "deflection_observed": false,
      "route_contract_match": false,
      "owner_boundary_present": true,
      "input_tokens": 151831,
      "cached_input_tokens": 124160,
      "output_tokens": 2209,
      "duration_ms": 54249,
      "transport_returncode": 0,
      "failure_class": "skill_load_gap",
      "adaptive_return_route": "repair_read_tooling_or_skill_load_then_repeat_same_case"
    },
    {
      "case_id": "collision-42",
      "arm_type": "implicit_control",
      "expected_target_skill": "aoa-eval",
      "expected_behavior": "invoke",
      "selected_target_exact": false,
      "selected_child_exact": false,
      "route_decision": "invoke",
      "manual_recommendation": false,
      "model_claims_loaded": false,
      "structured_skill_visible": false,
      "structured_skill_input_sent": false,
      "native_target_skill_input_accepted": false,
      "child_full_read_observed": false,
      "target_skill_full_read_observed": false,
      "prompt_visibility_contract_match": true,
      "fixture_filesystem_scope_match": true,
      "external_filesystem_access_count": 0,
      "prompt_visible_repo_skill_count": 0,
      "expected_prompt_visible_repo_skill_count": 0,
      "structured_skill_surface_contract_match": null,
      "external_runtime_isolation_match": null,
      "dispatch_contract_match": false,
      "load_contract_match": false,
      "procedure_disposition": "blocked_missing_input",
      "procedure_command_observed": true,
      "procedure_command_succeeded": true,
      "verification_observed": true,
      "procedure_contract_match": false,
      "completion_observed": false,
      "deflection_observed": true,
      "route_contract_match": false,
      "owner_boundary_present": true,
      "input_tokens": 41033,
      "cached_input_tokens": 27904,
      "output_tokens": 1594,
      "duration_ms": 34783,
      "transport_returncode": 0,
      "failure_class": null,
      "adaptive_return_route": null
    },
    {
      "case_id": "collision-45",
      "arm_type": "root_manual_child",
      "expected_target_skill": "aoa-eval",
      "expected_behavior": "trajectory",
      "selected_target_exact": true,
      "selected_child_exact": true,
      "route_decision": "invoke",
      "manual_recommendation": false,
      "model_claims_loaded": true,
      "structured_skill_visible": false,
      "structured_skill_input_sent": false,
      "native_target_skill_input_accepted": true,
      "child_full_read_observed": true,
      "target_skill_full_read_observed": false,
      "prompt_visibility_contract_match": true,
      "fixture_filesystem_scope_match": true,
      "external_filesystem_access_count": 0,
      "prompt_visible_repo_skill_count": 12,
      "expected_prompt_visible_repo_skill_count": 12,
      "structured_skill_surface_contract_match": null,
      "external_runtime_isolation_match": null,
      "dispatch_contract_match": true,
      "load_contract_match": true,
      "procedure_disposition": "completed",
      "procedure_command_observed": true,
      "procedure_command_succeeded": true,
      "verification_observed": true,
      "procedure_contract_match": true,
      "completion_observed": true,
      "deflection_observed": false,
      "route_contract_match": true,
      "owner_boundary_present": true,
      "input_tokens": 63710,
      "cached_input_tokens": 45312,
      "output_tokens": 1240,
      "duration_ms": 27807,
      "transport_returncode": 0,
      "failure_class": null,
      "adaptive_return_route": null
    },
    {
      "case_id": "desc-eval-apply-explicit",
      "arm_type": "app_server_structured",
      "expected_target_skill": "aoa-eval-apply",
      "expected_behavior": "explicit",
      "selected_target_exact": true,
      "selected_child_exact": false,
      "route_decision": "invoke",
      "manual_recommendation": false,
      "model_claims_loaded": true,
      "structured_skill_visible": true,
      "structured_skill_input_sent": true,
      "native_target_skill_input_accepted": true,
      "child_full_read_observed": false,
      "target_skill_full_read_observed": true,
      "prompt_visibility_contract_match": true,
      "fixture_filesystem_scope_match": true,
      "external_filesystem_access_count": 0,
      "prompt_visible_repo_skill_count": 12,
      "expected_prompt_visible_repo_skill_count": 12,
      "structured_skill_surface_contract_match": true,
      "external_runtime_isolation_match": true,
      "dispatch_contract_match": true,
      "load_contract_match": true,
      "procedure_disposition": "completed",
      "procedure_command_observed": true,
      "procedure_command_succeeded": true,
      "verification_observed": true,
      "procedure_contract_match": true,
      "completion_observed": true,
      "deflection_observed": false,
      "route_contract_match": true,
      "owner_boundary_present": true,
      "input_tokens": 14485,
      "cached_input_tokens": 0,
      "output_tokens": 345,
      "duration_ms": 25742,
      "transport_returncode": 0,
      "failure_class": null,
      "adaptive_return_route": null
    }
  ],
  "pair_count": 1,
  "pair_outcomes": [
    {
      "case_id": "collision-42",
      "expected_target_skill": "aoa-eval",
      "expected_behavior": "invoke",
      "aided_route_contract_match": false,
      "control_route_contract_match": false,
      "observed_lift": 0,
      "effect_class": "no_lift_both_incorrect",
      "fixture_context_match": true,
      "prompt_background_match": true,
      "prompt_visibility_contract_match": true,
      "aided_dispatch_contract_match": true,
      "control_dispatch_contract_match": false,
      "aided_load_contract_match": false,
      "control_load_contract_match": false,
      "input_token_delta": 110798,
      "duration_ms_delta": 19466
    }
  ],
  "failure_counts": {
    "skill_load_gap": 1
  },
  "raw_bundle_sha256": "605e10dc8928a18c25bebb7ca377446da2710c4efa00d48975c0e3b6e5078d9c",
  "raw_bundle_local_available": true,
  "review": {
    "status": "needs-rerun",
    "note_sha256": "ff729ddd00b726cdebe8712d9e2f0b48092ed40c87192a1ba32f52449184c718"
  },
  "stopped_early": false,
  "stop_reason": null,
  "proof_authority": false,
  "promotion_allowed": false,
  "aggregate_score": null
}
