{
  "schema_version": "aoa_skill_live_dispatch_public_receipt_v1",
  "run_digest": "410883b70a2de596da2800dda68239a4e24ae7a2add28efc90f8dc0198ff4bbb",
  "created_at": "2026-07-11T17:20:10Z",
  "cohort": "smoke",
  "model": "gpt-5.6-sol",
  "effort": "medium",
  "source_lock": {
    "head_commit": "e73fefb36c668f11611727e8a4d6a251876bec59052dfe5d2e336fe45c9590fb",
    "git_head_ref": "615b110de46fd4465c8c9b86dc5af40354a7c607",
    "plan_sha256": "4f5446efc7a0d754a9e6c95493f8b5e4cebbecda144aabf0898f69e8644b891c",
    "source_snapshot_sha256": "8293c92431639506791c0c00223dbde7cacd6cea4cd5309bbe86427d043b6156",
    "profile_revision": "7217588744c68b15cf12e0a2ac3de7af74f5b3cc623b72b985c0169406f5f7b4",
    "protocol_revision": "codex-cli-0.144.1-app-server-skill-input-v1"
  },
  "caps": {
    "max_concurrency": 1,
    "per_turn_weighted_token_limit": 28000,
    "trajectory_weighted_token_limit": 48000,
    "rollout_budget_reminder_at_remaining_tokens": [
      4000
    ],
    "per_turn_timeout_seconds": 180,
    "full_turn_timeout_seconds": 240,
    "max_transport_retries_before_turn_start": 0,
    "stop_after_first_safety_violation": true,
    "raw_private_only": true
  },
  "platform": {
    "identity": "redacted-local-codex",
    "private_transport": true
  },
  "trial_count": 4,
  "measures": [
    {
      "case_id": "collision-42",
      "arm_type": "implicit_aided",
      "expected_target_skill": "aoa-eval",
      "expected_behavior": "invoke",
      "selected_target_exact": true,
      "route_decision": "manual_required",
      "manual_recommendation": true,
      "model_claims_loaded": false,
      "structured_skill_visible": false,
      "structured_skill_input_sent": false,
      "child_full_read_observed": false,
      "route_contract_match": false,
      "owner_boundary_present": true,
      "input_tokens": 11541,
      "cached_input_tokens": 0,
      "output_tokens": 862,
      "duration_ms": 19351,
      "transport_returncode": 0,
      "failure_class": "implicit_trigger_miss",
      "adaptive_return_route": "repair_description_policy_then_repeat_adjacent_family"
    },
    {
      "case_id": "collision-42",
      "arm_type": "implicit_control",
      "expected_target_skill": "aoa-eval",
      "expected_behavior": "invoke",
      "selected_target_exact": true,
      "route_decision": "manual_required",
      "manual_recommendation": true,
      "model_claims_loaded": false,
      "structured_skill_visible": false,
      "structured_skill_input_sent": false,
      "child_full_read_observed": false,
      "route_contract_match": false,
      "owner_boundary_present": true,
      "input_tokens": 19921,
      "cached_input_tokens": 17920,
      "output_tokens": 701,
      "duration_ms": 19897,
      "transport_returncode": 0,
      "failure_class": null,
      "adaptive_return_route": null
    },
    {
      "case_id": "collision-45",
      "arm_type": "root_manual_child",
      "expected_target_skill": "aoa-eval",
      "expected_behavior": "trajectory",
      "selected_target_exact": true,
      "route_decision": "manual_required",
      "manual_recommendation": true,
      "model_claims_loaded": true,
      "structured_skill_visible": false,
      "structured_skill_input_sent": false,
      "child_full_read_observed": true,
      "route_contract_match": false,
      "owner_boundary_present": true,
      "input_tokens": 109684,
      "cached_input_tokens": 78848,
      "output_tokens": 1691,
      "duration_ms": 51977,
      "transport_returncode": 0,
      "failure_class": "collision_misroute",
      "adaptive_return_route": "repair_collision_family_then_repeat_adjacent_family"
    },
    {
      "case_id": "desc-eval-apply-explicit",
      "arm_type": "app_server_structured",
      "expected_target_skill": "aoa-eval-apply",
      "expected_behavior": "explicit",
      "selected_target_exact": true,
      "route_decision": "manual_required",
      "manual_recommendation": true,
      "model_claims_loaded": true,
      "structured_skill_visible": true,
      "structured_skill_input_sent": true,
      "child_full_read_observed": false,
      "route_contract_match": false,
      "owner_boundary_present": true,
      "input_tokens": 27092,
      "cached_input_tokens": 19200,
      "output_tokens": 481,
      "duration_ms": 36781,
      "transport_returncode": 0,
      "failure_class": "budget_exhausted",
      "adaptive_return_route": "review_caps_or_reduce_context_then_repeat_same_case"
    }
  ],
  "pair_count": 1,
  "pair_outcomes": [
    {
      "case_id": "collision-42",
      "expected_target_skill": "aoa-eval",
      "expected_behavior": "invoke",
      "aided_route_contract_match": false,
      "control_route_contract_match": false,
      "observed_lift": 0,
      "effect_class": "no_lift_both_incorrect",
      "fixture_context_match": true,
      "input_token_delta": -8380,
      "duration_ms_delta": -546
    }
  ],
  "failure_counts": {
    "implicit_trigger_miss": 1,
    "collision_misroute": 1,
    "budget_exhausted": 1
  },
  "raw_bundle_sha256": "79f593a0adfae1c803c5bd53931f16d094a7e086b2a2a223006b881227b34d34",
  "raw_bundle_local_available": true,
  "review": {
    "status": "needs-rerun",
    "note_sha256": "a6e94f996f495ba67fcf50f07c104728b78ce8c7c7489c598b77022e794ba9e3"
  },
  "stopped_early": true,
  "stop_reason": "budget_exhausted",
  "proof_authority": false,
  "promotion_allowed": false,
  "aggregate_score": null
}
