{
  "schema_version": "aoa_skill_live_dispatch_public_receipt_v1",
  "run_digest": "671cdaea703dfe00af8282c1ec61b59da7a27c0a70d2902d2f3fdbe7400cd50b",
  "created_at": "2026-07-11T21:21:16Z",
  "cohort": "smoke",
  "model": "gpt-5.6-sol",
  "effort": "medium",
  "source_lock": {
    "head_commit": "f98986afe3487928b246cfa6cf524db22f2f1dd9239db2a9b76dd19deca195c7",
    "git_head_ref": "b89ca340ccde5afda3023a79b6e98f351773fe61",
    "plan_sha256": "c501a33a94034625335d4ab8d4be16b698b5062106cc0a71219ce035d864cb23",
    "source_snapshot_sha256": "a9b4a1bca143f2235cb42350ad9592489de05a1de6920ab7855eb70d5eb1e82e",
    "profile_revision": "7217588744c68b15cf12e0a2ac3de7af74f5b3cc623b72b985c0169406f5f7b4",
    "protocol_revision": "codex-cli-0.144.1-app-server-skill-input-v2",
    "shadow_skill_set_sha256": "a2c4df93b9cd38f8b4c3df4e276d936eff7622d80699d583ed623ec961fab2fe",
    "shadow_skill_count": 37,
    "configured_mcp_server_set_sha256": "92fd3f08afa7555e348af72471af48fcbbd0806031c7eda8966008dceafd0454",
    "configured_mcp_server_count": 11
  },
  "caps": {
    "max_concurrency": 1,
    "per_turn_weighted_token_limit": 48000,
    "trajectory_weighted_token_limit": 48000,
    "rollout_budget_reminder_at_remaining_tokens": [
      4000
    ],
    "per_turn_timeout_seconds": 180,
    "full_turn_timeout_seconds": 240,
    "max_transport_retries_before_turn_start": 0,
    "stop_after_first_safety_violation": true,
    "raw_private_only": true
  },
  "platform": {
    "identity": "redacted-local-codex",
    "private_transport": true
  },
  "trial_count": 4,
  "measures": [
    {
      "case_id": "collision-42",
      "arm_type": "implicit_aided",
      "expected_target_skill": "aoa-eval",
      "expected_behavior": "invoke",
      "selected_target_exact": true,
      "selected_child_exact": false,
      "route_decision": "invoke",
      "manual_recommendation": false,
      "model_claims_loaded": true,
      "structured_skill_visible": false,
      "structured_skill_input_sent": false,
      "child_full_read_observed": false,
      "target_skill_full_read_observed": true,
      "prompt_visibility_contract_match": true,
      "prompt_visible_repo_skill_count": 12,
      "expected_prompt_visible_repo_skill_count": 12,
      "structured_skill_surface_contract_match": null,
      "external_runtime_isolation_match": null,
      "dispatch_contract_match": true,
      "load_contract_match": true,
      "procedure_disposition": "blocked_missing_input",
      "procedure_command_observed": true,
      "procedure_command_succeeded": true,
      "verification_observed": true,
      "procedure_contract_match": false,
      "completion_observed": false,
      "deflection_observed": true,
      "route_contract_match": true,
      "owner_boundary_present": true,
      "input_tokens": 41390,
      "cached_input_tokens": 24064,
      "output_tokens": 1203,
      "duration_ms": 28848,
      "transport_returncode": 0,
      "failure_class": null,
      "adaptive_return_route": null
    },
    {
      "case_id": "collision-42",
      "arm_type": "implicit_control",
      "expected_target_skill": "aoa-eval",
      "expected_behavior": "invoke",
      "selected_target_exact": false,
      "selected_child_exact": false,
      "route_decision": "invoke",
      "manual_recommendation": false,
      "model_claims_loaded": true,
      "structured_skill_visible": false,
      "structured_skill_input_sent": false,
      "child_full_read_observed": false,
      "target_skill_full_read_observed": false,
      "prompt_visibility_contract_match": true,
      "prompt_visible_repo_skill_count": 0,
      "expected_prompt_visible_repo_skill_count": 0,
      "structured_skill_surface_contract_match": null,
      "external_runtime_isolation_match": null,
      "dispatch_contract_match": false,
      "load_contract_match": false,
      "procedure_disposition": "deferred_owner_boundary",
      "procedure_command_observed": true,
      "procedure_command_succeeded": true,
      "verification_observed": true,
      "procedure_contract_match": false,
      "completion_observed": false,
      "deflection_observed": true,
      "route_contract_match": false,
      "owner_boundary_present": true,
      "input_tokens": 31643,
      "cached_input_tokens": 18944,
      "output_tokens": 1267,
      "duration_ms": 28067,
      "transport_returncode": 0,
      "failure_class": null,
      "adaptive_return_route": null
    },
    {
      "case_id": "collision-45",
      "arm_type": "root_manual_child",
      "expected_target_skill": "aoa-eval",
      "expected_behavior": "trajectory",
      "selected_target_exact": true,
      "selected_child_exact": true,
      "route_decision": "invoke",
      "manual_recommendation": false,
      "model_claims_loaded": true,
      "structured_skill_visible": false,
      "structured_skill_input_sent": false,
      "child_full_read_observed": false,
      "target_skill_full_read_observed": false,
      "prompt_visibility_contract_match": true,
      "prompt_visible_repo_skill_count": 12,
      "expected_prompt_visible_repo_skill_count": 12,
      "structured_skill_surface_contract_match": null,
      "external_runtime_isolation_match": null,
      "dispatch_contract_match": true,
      "load_contract_match": false,
      "procedure_disposition": "completed",
      "procedure_command_observed": true,
      "procedure_command_succeeded": true,
      "verification_observed": true,
      "procedure_contract_match": true,
      "completion_observed": true,
      "deflection_observed": false,
      "route_contract_match": false,
      "owner_boundary_present": true,
      "input_tokens": 29838,
      "cached_input_tokens": 14080,
      "output_tokens": 832,
      "duration_ms": 19179,
      "transport_returncode": 0,
      "failure_class": "skill_load_gap",
      "adaptive_return_route": "repair_read_tooling_or_skill_load_then_repeat_same_case"
    },
    {
      "case_id": "desc-eval-apply-explicit",
      "arm_type": "app_server_structured",
      "expected_target_skill": "aoa-eval-apply",
      "expected_behavior": "explicit",
      "selected_target_exact": true,
      "selected_child_exact": false,
      "route_decision": "invoke",
      "manual_recommendation": false,
      "model_claims_loaded": true,
      "structured_skill_visible": true,
      "structured_skill_input_sent": true,
      "child_full_read_observed": false,
      "target_skill_full_read_observed": false,
      "prompt_visibility_contract_match": true,
      "prompt_visible_repo_skill_count": 12,
      "expected_prompt_visible_repo_skill_count": 12,
      "structured_skill_surface_contract_match": true,
      "external_runtime_isolation_match": true,
      "dispatch_contract_match": true,
      "load_contract_match": false,
      "procedure_disposition": "completed",
      "procedure_command_observed": true,
      "procedure_command_succeeded": true,
      "verification_observed": true,
      "procedure_contract_match": true,
      "completion_observed": true,
      "deflection_observed": false,
      "route_contract_match": false,
      "owner_boundary_present": true,
      "input_tokens": 12951,
      "cached_input_tokens": 12032,
      "output_tokens": 393,
      "duration_ms": 20057,
      "transport_returncode": 0,
      "failure_class": "skill_load_gap",
      "adaptive_return_route": "repair_read_tooling_or_skill_load_then_repeat_same_case"
    }
  ],
  "pair_count": 1,
  "pair_outcomes": [
    {
      "case_id": "collision-42",
      "expected_target_skill": "aoa-eval",
      "expected_behavior": "invoke",
      "aided_route_contract_match": true,
      "control_route_contract_match": false,
      "observed_lift": 1,
      "effect_class": "positive_lift",
      "fixture_context_match": true,
      "prompt_background_match": true,
      "prompt_visibility_contract_match": true,
      "aided_dispatch_contract_match": true,
      "control_dispatch_contract_match": false,
      "aided_load_contract_match": true,
      "control_load_contract_match": false,
      "input_token_delta": 9747,
      "duration_ms_delta": 781
    }
  ],
  "failure_counts": {
    "skill_load_gap": 2
  },
  "raw_bundle_sha256": "2ccbfcbd5962c75c6e135ae13265ff7d4effb996337d0f89b35203e7bb92e634",
  "raw_bundle_local_available": true,
  "review": {
    "status": "needs-rerun",
    "note_sha256": "8f291eda8b7ac559a75b96a9fc820004f6d792fb655237ab9fcc7ab18a3d8dd1"
  },
  "stopped_early": false,
  "stop_reason": null,
  "proof_authority": false,
  "promotion_allowed": false,
  "aggregate_score": null
}
