{
  "schema_version": "aoa_skill_live_dispatch_public_receipt_v1",
  "run_digest": "699dc90ffa69a2eecd7bc2ca5f30279d90f79494c45f92d1e97696a1f76073e2",
  "created_at": "2026-07-11T22:58:57Z",
  "cohort": "smoke",
  "model": "gpt-5.6-sol",
  "effort": "medium",
  "source_lock": {
    "head_commit": "84255983117c909834f5dc3210d106bd5f9fb5f814f74638596fc3983c60eba8",
    "git_head_ref": "caea4eca5ed869a82654f32d466628fe4f0e5977",
    "plan_sha256": "6e14fd8ba6408bfe0b2966bf71c263807ac628618378e909b8c36deaed61ce39",
    "source_snapshot_sha256": "eda6ffb3d05a0823428e5ac056cd8e7b7c95f8f812ea5b105283100a5291d155",
    "profile_revision": "cf01327152e819c6bb810645dd203d8f90224574b568e623ec5dc6328045b9df",
    "protocol_revision": "codex-cli-0.144.1-live-dispatch-evidence-v4",
    "shadow_skill_set_sha256": "a2c4df93b9cd38f8b4c3df4e276d936eff7622d80699d583ed623ec961fab2fe",
    "shadow_skill_count": 37,
    "configured_mcp_server_set_sha256": "92fd3f08afa7555e348af72471af48fcbbd0806031c7eda8966008dceafd0454",
    "configured_mcp_server_count": 11
  },
  "caps": {
    "max_concurrency": 1,
    "per_turn_weighted_token_limit": 48000,
    "trajectory_weighted_token_limit": 48000,
    "rollout_budget_reminder_at_remaining_tokens": [
      4000
    ],
    "per_turn_timeout_seconds": 180,
    "full_turn_timeout_seconds": 240,
    "max_transport_retries_before_turn_start": 0,
    "stop_after_first_safety_violation": true,
    "raw_private_only": true
  },
  "platform": {
    "identity": "redacted-local-codex",
    "private_transport": true
  },
  "trial_count": 2,
  "measures": [
    {
      "case_id": "collision-42",
      "arm_type": "implicit_aided",
      "expected_target_skill": "aoa-eval",
      "expected_behavior": "invoke",
      "selected_target_exact": true,
      "selected_child_exact": false,
      "route_decision": "invoke",
      "manual_recommendation": false,
      "model_claims_loaded": true,
      "structured_skill_visible": false,
      "structured_skill_input_sent": false,
      "native_target_skill_input_accepted": false,
      "child_full_read_observed": true,
      "target_skill_full_read_observed": true,
      "prompt_visibility_contract_match": true,
      "prompt_visible_repo_skill_count": 12,
      "expected_prompt_visible_repo_skill_count": 12,
      "structured_skill_surface_contract_match": null,
      "external_runtime_isolation_match": null,
      "dispatch_contract_match": true,
      "load_contract_match": true,
      "procedure_disposition": "blocked_missing_input",
      "procedure_command_observed": true,
      "procedure_command_succeeded": true,
      "verification_observed": true,
      "procedure_contract_match": false,
      "completion_observed": false,
      "deflection_observed": true,
      "route_contract_match": true,
      "owner_boundary_present": true,
      "input_tokens": 95451,
      "cached_input_tokens": 68608,
      "output_tokens": 2157,
      "duration_ms": 55928,
      "transport_returncode": 0,
      "failure_class": null,
      "adaptive_return_route": null
    },
    {
      "case_id": "collision-42",
      "arm_type": "implicit_control",
      "expected_target_skill": "aoa-eval",
      "expected_behavior": "invoke",
      "selected_target_exact": false,
      "selected_child_exact": false,
      "route_decision": null,
      "manual_recommendation": false,
      "model_claims_loaded": false,
      "structured_skill_visible": false,
      "structured_skill_input_sent": false,
      "native_target_skill_input_accepted": false,
      "child_full_read_observed": false,
      "target_skill_full_read_observed": false,
      "prompt_visibility_contract_match": true,
      "prompt_visible_repo_skill_count": 0,
      "expected_prompt_visible_repo_skill_count": 0,
      "structured_skill_surface_contract_match": null,
      "external_runtime_isolation_match": null,
      "dispatch_contract_match": false,
      "load_contract_match": false,
      "procedure_disposition": null,
      "procedure_command_observed": false,
      "procedure_command_succeeded": false,
      "verification_observed": false,
      "procedure_contract_match": false,
      "completion_observed": false,
      "deflection_observed": false,
      "route_contract_match": false,
      "owner_boundary_present": false,
      "input_tokens": 0,
      "cached_input_tokens": 0,
      "output_tokens": 0,
      "duration_ms": 64275,
      "transport_returncode": 1,
      "failure_class": "budget_exhausted",
      "adaptive_return_route": "review_caps_or_reduce_context_then_repeat_same_case"
    }
  ],
  "pair_count": 0,
  "pair_outcomes": [],
  "failure_counts": {
    "budget_exhausted": 1
  },
  "raw_bundle_sha256": "24d3b9c9a79a1afd99a730f7b535bee587b3ac9b8432173f06f8b1d685bc1e1d",
  "raw_bundle_local_available": true,
  "review": {
    "status": "needs-rerun",
    "note_sha256": "3f30df7648e6b469ae84432810ee494ad28db3c886c6b0032259d0b900c7a359"
  },
  "stopped_early": true,
  "stop_reason": "budget_exhausted",
  "proof_authority": false,
  "promotion_allowed": false,
  "aggregate_score": null
}
