{
  "schema_version": "aoa_skill_live_dispatch_public_receipt_v1",
  "run_digest": "30c22d6c3f9ef97c2e1d347f3042cebe96d557971e6a99b7d2b171a92d385d97",
  "created_at": "2026-07-11T16:29:36Z",
  "cohort": "smoke",
  "model": "gpt-5.6-sol",
  "effort": "medium",
  "source_lock": {
    "head_commit": "200134985a7fcfa34960647f34402fed17494f22cc58d113fdfa18def55e1189",
    "git_head_ref": "f99455575c03a2a7dcde1e24e4f2f91fe8d99a69",
    "plan_sha256": "b664d5776c391f908476150ed026972d38c8f090a37ea99d64ecb6a3b336c312",
    "source_snapshot_sha256": "320c63d349be29004e6184ba8016a80b65e80318356aa68c993e3367d88b8acd",
    "profile_revision": "7217588744c68b15cf12e0a2ac3de7af74f5b3cc623b72b985c0169406f5f7b4",
    "protocol_revision": "codex-cli-0.144.1-app-server-skill-input-v1"
  },
  "caps": {
    "max_concurrency": 1,
    "per_turn_weighted_token_limit": 28000,
    "per_turn_timeout_seconds": 180,
    "full_turn_timeout_seconds": 240,
    "max_transport_retries_before_turn_start": 0,
    "stop_after_first_safety_violation": true,
    "raw_private_only": true
  },
  "platform": {
    "identity": "redacted-local-codex",
    "private_transport": true
  },
  "trial_count": 1,
  "measures": [
    {
      "case_id": "collision-42",
      "arm_type": "implicit_aided",
      "expected_target_skill": "aoa-eval",
      "expected_behavior": "invoke",
      "selected_target_exact": false,
      "route_decision": null,
      "manual_recommendation": false,
      "model_claims_loaded": false,
      "structured_skill_visible": false,
      "structured_skill_input_sent": false,
      "child_full_read_observed": false,
      "route_contract_match": false,
      "owner_boundary_present": false,
      "input_tokens": 0,
      "cached_input_tokens": 0,
      "output_tokens": 0,
      "duration_ms": 37,
      "transport_returncode": 1,
      "failure_class": "transport_failure",
      "adaptive_return_route": "repair_transport_then_repeat_same_case_once"
    }
  ],
  "pair_count": 0,
  "pair_outcomes": [],
  "failure_counts": {
    "transport_failure": 1
  },
  "raw_bundle_sha256": "f3c67bf9df984d6d1708ff30533718838420add9ddab2bae14366a723471e037",
  "raw_bundle_local_available": true,
  "review": {
    "status": "needs-rerun",
    "note_sha256": "4ee0c9d6fbcf4d6b8dbd991adaa98b2729977145703ed4155f1f03d3f7c0a6eb"
  },
  "stopped_early": true,
  "stop_reason": "transport_failure",
  "proof_authority": false,
  "promotion_allowed": false,
  "aggregate_score": null
}
