{
  "schema_version": "aoa_skill_live_dispatch_public_receipt_v1",
  "run_digest": "cbd48343d68821d2552e92b5814d34d95e44e869e23e80ff9bc9e03518c13b23",
  "created_at": "2026-07-11T17:03:15Z",
  "cohort": "smoke",
  "model": "gpt-5.6-sol",
  "effort": "medium",
  "source_lock": {
    "head_commit": "ba7e1bc924cea15e7ae38e61a4b35f7de4fd99dc11227c8e38b3ec93e753d9ee",
    "git_head_ref": "00a8d380fa2470acb87414a2e570921c184e9624",
    "plan_sha256": "3358d9a7f1c8856905999b1a7bcfbb16774fc28a0e9ab82f068020b803f39e69",
    "source_snapshot_sha256": "e04964a5ee46b7ab9a23023fda375025a97fb96da8926e34fa9f64a0b6d5c35f",
    "profile_revision": "7217588744c68b15cf12e0a2ac3de7af74f5b3cc623b72b985c0169406f5f7b4",
    "protocol_revision": "codex-cli-0.144.1-app-server-skill-input-v1"
  },
  "caps": {
    "max_concurrency": 1,
    "per_turn_weighted_token_limit": 28000,
    "rollout_budget_reminder_at_remaining_tokens": [
      4000
    ],
    "per_turn_timeout_seconds": 180,
    "full_turn_timeout_seconds": 240,
    "max_transport_retries_before_turn_start": 0,
    "stop_after_first_safety_violation": true,
    "raw_private_only": true
  },
  "platform": {
    "identity": "redacted-local-codex",
    "private_transport": true
  },
  "trial_count": 3,
  "measures": [
    {
      "case_id": "collision-42",
      "arm_type": "implicit_aided",
      "expected_target_skill": "aoa-eval",
      "expected_behavior": "invoke",
      "selected_target_exact": true,
      "route_decision": "manual_required",
      "manual_recommendation": true,
      "model_claims_loaded": false,
      "structured_skill_visible": false,
      "structured_skill_input_sent": false,
      "child_full_read_observed": false,
      "route_contract_match": false,
      "owner_boundary_present": true,
      "input_tokens": 11496,
      "cached_input_tokens": 0,
      "output_tokens": 945,
      "duration_ms": 22572,
      "transport_returncode": 0,
      "failure_class": "implicit_trigger_miss",
      "adaptive_return_route": "repair_description_policy_then_repeat_adjacent_family"
    },
    {
      "case_id": "collision-42",
      "arm_type": "implicit_control",
      "expected_target_skill": "aoa-eval",
      "expected_behavior": "invoke",
      "selected_target_exact": true,
      "route_decision": "manual_required",
      "manual_recommendation": true,
      "model_claims_loaded": false,
      "structured_skill_visible": false,
      "structured_skill_input_sent": false,
      "child_full_read_observed": false,
      "route_contract_match": false,
      "owner_boundary_present": true,
      "input_tokens": 20030,
      "cached_input_tokens": 8960,
      "output_tokens": 814,
      "duration_ms": 25438,
      "transport_returncode": 0,
      "failure_class": null,
      "adaptive_return_route": null
    },
    {
      "case_id": "collision-45",
      "arm_type": "root_manual_child",
      "expected_target_skill": "aoa-eval",
      "expected_behavior": "trajectory",
      "selected_target_exact": false,
      "route_decision": null,
      "manual_recommendation": false,
      "model_claims_loaded": false,
      "structured_skill_visible": false,
      "structured_skill_input_sent": false,
      "child_full_read_observed": true,
      "route_contract_match": false,
      "owner_boundary_present": false,
      "input_tokens": 0,
      "cached_input_tokens": 0,
      "output_tokens": 0,
      "duration_ms": 42776,
      "transport_returncode": 1,
      "failure_class": "transport_failure",
      "adaptive_return_route": "repair_transport_then_repeat_same_case_once"
    }
  ],
  "pair_count": 1,
  "pair_outcomes": [
    {
      "case_id": "collision-42",
      "expected_target_skill": "aoa-eval",
      "expected_behavior": "invoke",
      "aided_route_contract_match": false,
      "control_route_contract_match": false,
      "observed_lift": 0,
      "effect_class": "no_lift_both_incorrect",
      "fixture_context_match": true,
      "input_token_delta": -8534,
      "duration_ms_delta": -2866
    }
  ],
  "failure_counts": {
    "implicit_trigger_miss": 1,
    "transport_failure": 1
  },
  "raw_bundle_sha256": "b1584d34621a06c32b02c5601c0c6730e97e0dc31d2346b6feb4a9803032abbe",
  "raw_bundle_local_available": true,
  "review": {
    "status": "needs-rerun",
    "note_sha256": "e318cd382bbf181205689a5182c517c70d64e933035e420b68f34b13ddb3d0ca"
  },
  "stopped_early": true,
  "stop_reason": "transport_failure",
  "proof_authority": false,
  "promotion_allowed": false,
  "aggregate_score": null
}
